[
  {
    "schema_version": "1.2",
    "record_id": "FL001-B01-20261006131341",
    "type": "BOLT",
    "flange_id": "FL001",
    "bolt_id": "B01",
    "inspector": "이검사",
    "device_id": "TAB-01",
    "inspected_at": "2026-10-06T13:13:41+09:00",
    "vision": {
      "protrusion_mm": 5.8,
      "thread_count": 2,
      "confidence": 0.98,
      "crop_jpg_b64": null,
      "result": "OK",
      "marking": {
        "gap_pct": 0.9,
        "method": "auto",
        "color": "red",
        "result": "OK"
      }
    },
    "gap": null,
    "tapping": {
      "peak_hz": 3232.7,
      "decay_ms": null,
      "score": 0,
      "model": "range",
      "result": "OK",
      "features": {
        "mic": {
          "peak_hz": 3232.7,
          "mag": 0.847,
          "energy_pct": 70.2
        },
        "acc": {
          "peak_hz": 420.4,
          "mag": 0.668,
          "energy_pct": 72.8
        }
      },
      "checks": {
        "mic": {
          "peak_hz": true,
          "mag": true,
          "energy_pct": true
        },
        "acc": {
          "peak_hz": true,
          "mag": true,
          "energy_pct": true
        }
      },
      "sensor_results": {
        "mic": "OK",
        "acc": "OK"
      },
      "ref_source": "실측 등록 n=10 ±3.0σ"
    },
    "final_result": "OK",
    "app_version": "0.1"
  },
  {
    "schema_version": "1.2",
    "record_id": "FL001-B02-20261006131410",
    "type": "BOLT",
    "flange_id": "FL001",
    "bolt_id": "B02",
    "inspector": "이검사",
    "device_id": "TAB-01",
    "inspected_at": "2026-10-06T13:14:10+09:00",
    "vision": {
      "protrusion_mm": 6.4,
      "thread_count": 3,
      "confidence": 0.97,
      "crop_jpg_b64": null,
      "result": "OK",
      "marking": {
        "gap_pct": 0.6,
        "method": "auto",
        "color": "red",
        "result": "OK"
      }
    },
    "gap": null,
    "tapping": {
      "peak_hz": 3073.5,
      "decay_ms": null,
      "score": 0,
      "model": "range",
      "result": "OK",
      "features": {
        "mic": {
          "peak_hz": 3073.5,
          "mag": 0.765,
          "energy_pct": 70.7
        },
        "acc": {
          "peak_hz": 424.9,
          "mag": 0.706,
          "energy_pct": 68.6
        }
      },
      "checks": {
        "mic": {
          "peak_hz": true,
          "mag": true,
          "energy_pct": true
        },
        "acc": {
          "peak_hz": true,
          "mag": true,
          "energy_pct": true
        }
      },
      "sensor_results": {
        "mic": "OK",
        "acc": "OK"
      },
      "ref_source": "실측 등록 n=10 ±3.0σ"
    },
    "final_result": "OK",
    "app_version": "0.1"
  },
  {
    "schema_version": "1.2",
    "record_id": "FL001-B03-20261006131451",
    "type": "BOLT",
    "flange_id": "FL001",
    "bolt_id": "B03",
    "inspector": "이검사",
    "device_id": "TAB-01",
    "inspected_at": "2026-10-06T13:14:51+09:00",
    "vision": {
      "protrusion_mm": 7.2,
      "thread_count": 3,
      "confidence": 0.88,
      "crop_jpg_b64": null,
      "result": "OK",
      "marking": {
        "gap_pct": 3.6,
        "method": "auto",
        "color": "red",
        "result": "OK"
      }
    },
    "gap": null,
    "tapping": {
      "peak_hz": 3175.9,
      "decay_ms": null,
      "score": 1,
      "model": "range",
      "result": "CHECK",
      "features": {
        "mic": {
          "peak_hz": 3175.9,
          "mag": 0.783,
          "energy_pct": 70.3
        },
        "acc": {
          "peak_hz": 435.8,
          "mag": 0.715,
          "energy_pct": 70.4
        }
      },
      "checks": {
        "mic": {
          "peak_hz": true,
          "mag": true,
          "energy_pct": true
        },
        "acc": {
          "peak_hz": false,
          "mag": true,
          "energy_pct": true
        }
      },
      "sensor_results": {
        "mic": "OK",
        "acc": "CHECK"
      },
      "ref_source": "실측 등록 n=10 ±3.0σ"
    },
    "final_result": "CHECK",
    "app_version": "0.1"
  },
  {
    "schema_version": "1.2",
    "record_id": "FL001-B04-20261006131541",
    "type": "BOLT",
    "flange_id": "FL001",
    "bolt_id": "B04",
    "inspector": "박안전",
    "device_id": "TAB-01",
    "inspected_at": "2026-10-06T13:15:41+09:00",
    "vision": {
      "protrusion_mm": 4.8,
      "thread_count": 2,
      "confidence": 0.92,
      "crop_jpg_b64": null,
      "result": "CHECK",
      "marking": {
        "gap_pct": 2.5,
        "method": "auto",
        "color": "red",
        "result": "OK"
      }
    },
    "gap": null,
    "tapping": {
      "peak_hz": 3123.9,
      "decay_ms": null,
      "score": 0,
      "model": "range",
      "result": "OK",
      "features": {
        "mic": {
          "peak_hz": 3123.9,
          "mag": 0.799,
          "energy_pct": 68.6
        },
        "acc": {
          "peak_hz": 411.9,
          "mag": 0.713,
          "energy_pct": 69.7
        }
      },
      "checks": {
        "mic": {
          "peak_hz": true,
          "mag": true,
          "energy_pct": true
        },
        "acc": {
          "peak_hz": true,
          "mag": true,
          "energy_pct": true
        }
      },
      "sensor_results": {
        "mic": "OK",
        "acc": "OK"
      },
      "ref_source": "실측 등록 n=10 ±3.0σ"
    },
    "final_result": "CHECK",
    "app_version": "0.1"
  },
  {
    "schema_version": "1.2",
    "record_id": "FL001-GAP-20261006131741",
    "type": "GAP",
    "flange_id": "FL001",
    "bolt_id": "GAP",
    "inspector": "이검사",
    "device_id": "TAB-01",
    "inspected_at": "2026-10-06T13:17:41+09:00",
    "vision": null,
    "gap": {
      "gap_mm": [
        2.11,
        2.15,
        2.27,
        2.01
      ],
      "gap_diff_mm": 0.26,
      "result": "OK"
    },
    "tapping": null,
    "final_result": "OK",
    "app_version": "0.1"
  },
  {
    "schema_version": "1.2",
    "record_id": "FL001-B01-20261009120130",
    "type": "BOLT",
    "flange_id": "FL001",
    "bolt_id": "B01",
    "inspector": "이검사",
    "device_id": "TAB-01",
    "inspected_at": "2026-10-09T12:01:30+09:00",
    "vision": {
      "protrusion_mm": 6.7,
      "thread_count": 3,
      "confidence": 0.8,
      "crop_jpg_b64": null,
      "result": "OK",
      "marking": {
        "gap_pct": 2.3,
        "method": "auto",
        "color": "red",
        "result": "OK"
      }
    },
    "gap": null,
    "tapping": {
      "peak_hz": 3272.3,
      "decay_ms": null,
      "score": 0,
      "model": "range",
      "result": "OK",
      "features": {
        "mic": {
          "peak_hz": 3272.3,
          "mag": 0.827,
          "energy_pct": 71.2
        },
        "acc": {
          "peak_hz": 416.7,
          "mag": 0.723,
          "energy_pct": 71.7
        }
      },
      "checks": {
        "mic": {
          "peak_hz": true,
          "mag": true,
          "energy_pct": true
        },
        "acc": {
          "peak_hz": true,
          "mag": true,
          "energy_pct": true
        }
      },
      "sensor_results": {
        "mic": "OK",
        "acc": "OK"
      },
      "ref_source": "실측 등록 n=10 ±3.0σ"
    },
    "final_result": "OK",
    "app_version": "0.1"
  },
  {
    "schema_version": "1.2",
    "record_id": "FL001-B02-20261009120215",
    "type": "BOLT",
    "flange_id": "FL001",
    "bolt_id": "B02",
    "inspector": "김현장",
    "device_id": "TAB-01",
    "inspected_at": "2026-10-09T12:02:15+09:00",
    "vision": {
      "protrusion_mm": 6.7,
      "thread_count": 3,
      "confidence": 0.79,
      "crop_jpg_b64": null,
      "result": "OK",
      "marking": {
        "gap_pct": 3.2,
        "method": "auto",
        "color": "red",
        "result": "OK"
      }
    },
    "gap": null,
    "tapping": {
      "peak_hz": 3174.7,
      "decay_ms": null,
      "score": 0,
      "model": "range",
      "result": "OK",
      "features": {
        "mic": {
          "peak_hz": 3174.7,
          "mag": 0.792,
          "energy_pct": 66.4
        },
        "acc": {
          "peak_hz": 409.9,
          "mag": 0.73,
          "energy_pct": 71.6
        }
      },
      "checks": {
        "mic": {
          "peak_hz": true,
          "mag": true,
          "energy_pct": true
        },
        "acc": {
          "peak_hz": true,
          "mag": true,
          "energy_pct": true
        }
      },
      "sensor_results": {
        "mic": "OK",
        "acc": "OK"
      },
      "ref_source": "실측 등록 n=10 ±3.0σ"
    },
    "final_result": "OK",
    "app_version": "0.1"
  },
  {
    "schema_version": "1.2",
    "record_id": "FL001-B03-20261009120302",
    "type": "BOLT",
    "flange_id": "FL001",
    "bolt_id": "B03",
    "inspector": "김현장",
    "device_id": "TAB-01",
    "inspected_at": "2026-10-09T12:03:02+09:00",
    "vision": {
      "protrusion_mm": 5.8,
      "thread_count": 2,
      "confidence": 0.85,
      "crop_jpg_b64": null,
      "result": "OK",
      "marking": {
        "gap_pct": 2.9,
        "method": "auto",
        "color": "red",
        "result": "OK"
      }
    },
    "gap": null,
    "tapping": {
      "peak_hz": 3214.1,
      "decay_ms": null,
      "score": 0,
      "model": "range",
      "result": "OK",
      "features": {
        "mic": {
          "peak_hz": 3214.1,
          "mag": 0.825,
          "energy_pct": 65.5
        },
        "acc": {
          "peak_hz": 414.5,
          "mag": 0.714,
          "energy_pct": 72.8
        }
      },
      "checks": {
        "mic": {
          "peak_hz": true,
          "mag": true,
          "energy_pct": true
        },
        "acc": {
          "peak_hz": true,
          "mag": true,
          "energy_pct": true
        }
      },
      "sensor_results": {
        "mic": "OK",
        "acc": "OK"
      },
      "ref_source": "실측 등록 n=10 ±3.0σ"
    },
    "final_result": "OK",
    "app_version": "0.1"
  },
  {
    "schema_version": "1.2",
    "record_id": "FL001-B04-20261009120331",
    "type": "BOLT",
    "flange_id": "FL001",
    "bolt_id": "B04",